15:31:21.467021 ARP, Request who-has 10.0.0.2 tell 10.0.0.1, length 28
15:31:21.467513 ARP, Reply 10.0.0.2 is-at 00:04:00:00:00:01 (oui Unknown), length 28
15:31:21.467533 IP 10.0.0.1 > 10.0.0.2: ICMP echo request, id 4133, seq 1, length 64
15:31:21.468108 IP 10.0.0.2 > 10.0.0.1: ICMP echo reply, id 4133, seq 1, length 64
15:31:21.467376 ARP, Request who-has 10.0.0.2 tell 10.0.0.1, length 28
15:31:21.467392 ARP, Reply 10.0.0.2 is-at 00:04:00:00:00:01 (oui Unknown), length 28
15:31:21.467976 IP 10.0.0.1 > 10.0.0.2: ICMP echo request, id 4133, seq 1, length 64
15:31:21.467990 IP 10.0.0.2 > 10.0.0.1: ICMP echo reply, id 4133, seq 1, length 64
15:31:22.468914 IP 10.0.0.1 > 10.0.0.2: ICMP echo request, id 4133, seq 2, length 64
15:31:22.468934 IP 10.0.0.2 > 10.0.0.1: ICMP echo reply, id 4133, seq 2, length 64
15:31:22.468518 IP 10.0.0.1 > 10.0.0.2: ICMP echo request, id 4133, seq 2, length 64
15:31:22.469066 IP 10.0.0.2 > 10.0.0.1: ICMP echo reply, id 4133, seq 2, length 64
15:31:23.467509 IP 10.0.0.1 > 10.0.0.2: ICMP echo request, id 4133, seq 3, length 64
15:31:23.467885 IP 10.0.0.2 > 10.0.0.1: ICMP echo reply, id 4133, seq 3, length 64
15:31:23.467779 IP 10.0.0.1 > 10.0.0.2: ICMP echo request, id 4133, seq 3, length 64
15:31:23.467792 IP 10.0.0.2 > 10.0.0.1: ICMP echo reply, id 4133, seq 3, length 64
15:31:24.466511 IP 10.0.0.1 > 10.0.0.2: ICMP echo request, id 4133, seq 4, length 64
15:31:24.467005 IP 10.0.0.2 > 10.0.0.1: ICMP echo reply, id 4133, seq 4, length 64
15:31:24.466845 IP 10.0.0.1 > 10.0.0.2: ICMP echo request, id 4133, seq 4, length 64
15:31:24.466864 IP 10.0.0.2 > 10.0.0.1: ICMP echo reply, id 4133, seq 4, length 64
15:31:25.467505 IP 10.0.0.1 > 10.0.0.2: ICMP echo request, id 4133, seq 5, length 64
15:31:25.468022 IP 10.0.0.2 > 10.0.0.1: ICMP echo reply, id 4133, seq 5, length 64
15:31:25.467854 IP 10.0.0.1 > 10.0.0.2: ICMP echo request, id 4133, seq 5, length 64
15:31:25.467872 IP 10.0.0.2 > 10.0.0.1: ICMP echo reply, id 4133, seq 5, length 64
15:31:26.469276 IP 10.0.0.1 > 10.0.0.2: ICMP echo request, id 4133, seq 6, length 64
15:31:26.470214 IP 10.0.0.2 > 10.0.0.1: ICMP echo reply, id 4133, seq 6, length 64
15:31:26.478696 ARP, Request who-has 10.0.0.1 tell 10.0.0.2, length 28
15:31:26.478709 ARP, Reply 10.0.0.1 is-at 00:04:00:00:00:00 (oui Unknown), length 28
15:31:26.469814 IP 10.0.0.1 > 10.0.0.2: ICMP echo request, id 4133, seq 6, length 64
15:31:26.469832 IP 10.0.0.2 > 10.0.0.1: ICMP echo reply, id 4133, seq 6, length 64
15:31:26.478432 ARP, Request who-has 10.0.0.1 tell 10.0.0.2, length 28
15:31:26.478825 ARP, Reply 10.0.0.1 is-at 00:04:00:00:00:00 (oui Unknown), length 28
15:31:27.470497 IP 10.0.0.1 > 10.0.0.2: ICMP echo request, id 4133, seq 7, length 64
15:31:27.470935 IP 10.0.0.2 > 10.0.0.1: ICMP echo reply, id 4133, seq 7, length 64
15:31:27.470773 IP 10.0.0.1 > 10.0.0.2: ICMP echo request, id 4133, seq 7, length 64
15:31:27.470790 IP 10.0.0.2 > 10.0.0.1: ICMP echo reply, id 4133, seq 7, length 64
15:31:28.470003 IP 10.0.0.1 > 10.0.0.2: ICMP echo request, id 4133, seq 8, length 64
15:31:28.470427 IP 10.0.0.2 > 10.0.0.1: ICMP echo reply, id 4133, seq 8, length 64
15:31:28.470265 IP 10.0.0.1 > 10.0.0.2: ICMP echo request, id 4133, seq 8, length 64
15:31:28.470281 IP 10.0.0.2 > 10.0.0.1: ICMP echo reply, id 4133, seq 8, length 64
15:31:29.470310 IP 10.0.0.1 > 10.0.0.2: ICMP echo request, id 4133, seq 9, length 64
15:31:29.470330 IP 10.0.0.2 > 10.0.0.1: ICMP echo reply, id 4133, seq 9, length 64
15:31:29.470015 IP 10.0.0.1 > 10.0.0.2: ICMP echo request, id 4133, seq 9, length 64
15:31:29.470465 IP 10.0.0.2 > 10.0.0.1: ICMP echo reply, id 4133, seq 9, length 64
15:31:30.470127 IP 10.0.0.1 > 10.0.0.2: ICMP echo request, id 4133, seq 10, length 64
15:31:30.470625 IP 10.0.0.2 > 10.0.0.1: ICMP echo reply, id 4133, seq 10, length 64
15:31:30.470454 IP 10.0.0.1 > 10.0.0.2: ICMP echo request, id 4133, seq 10, length 64
15:31:30.470472 IP 10.0.0.2 > 10.0.0.1: ICMP echo reply, id 4133, seq 10, length 64
